{
  "$schema": "http://json-schema.org/draft-06/schema#",
  "title": "Mbed Library Schema",
  "description": "Configuration file for an mbed library",
  "type": "object",
  "$id": "http://example.com/root.json",
  "properties": {
    "name": {
      "$ref": "file:definitions.json#/name_definition"
    },
    "config": {
      "$ref": "file:definitions.json#/config_definition"
    },
    "target_overrides": {
      "$ref": "file:definitions.json#/target_overrides_definition"
    },
    "macros": {
      "$ref": "file:definitions.json#/macro_definition"
    },
    "artifact_name": {
      "type": "string"
    }
  },
  "additionalProperties": false
}
