{
    "name": "cordio-nordic-ll",
    "config": {
        "zero-copy-hci": {
            "help": "messages sent between Host and Controller are passed directly without copying if enabled. WSF messages ownership is trasfered to the callee.",
            "value": 1,
            "macro_name": "CORDIO_ZERO_COPY_HCI"
        },
        "hci-driver-buffer-size": {
            "help": "Defines the memory to be allocated by the NRFCordiHciDriver.",
            "value": 12500
        },
        "wsf-pool-buffer-size": {
            "help": "Defines the memory allocated for the wsf memory pool.",
            "value": 4900
        }
    },
    "target_overrides": {
        "MCU_NRF52840": {
            "hci-driver-buffer-size": 16056
        }
    },
    "macros": [
        "INIT_BROADCASTER",
        "INIT_OBSERVER",
        "INIT_CENTRAL",
        "INIT_PERIPHERAL",
        "INIT_ENCRYPTED",
        "LHCI_ENABLE_VS=0",
        "BB_CLK_RATE_HZ=1000000",
        "LL_MAX_PER_SCAN=3"
    ]
}
